{
  "version": "release-artifact-drift-evidence.v1",
  "kind": "historical_signed_rc_artifact_drift_evidence",
  "observed_on": "2026-07-21",
  "verification": {
    "mode": "explicit_read_only_local_release_artifact_integrity",
    "local_release_artifacts_read": 3,
    "artifact_bytes_modified": false,
    "queue_requested": false,
    "queue_files_read": false
  },
  "observed_artifacts": {
    "manifest": {
      "path": "out/releases/release-manifest-0.1.0-rc.2.json",
      "size_bytes": 1000,
      "sha256": "sha256:8d19bb41f3df12353365be2ab6c1f6c7e27cb0ccf0a2a9ed4095e48e4a78296a",
      "mtime_observed": "2026-07-15T05:06:16.827Z"
    },
    "sidecar": {
      "path": "out/releases/alma-sketchup-mcp-0.1.0-rc.2.sha256",
      "size_bytes": 99,
      "sha256": "sha256:45c39d3e28e705b046700a13f0b525b68634fe28ee1bbf83ee0282d57ec0aac7",
      "mtime_observed": "2026-07-15T05:06:16.826Z"
    },
    "rbz": {
      "path": "out/releases/alma-sketchup-mcp-0.1.0-rc.2.rbz",
      "size_bytes": 90432,
      "sha256": "sha256:01a95525bd73d48d40e1e50e2fee61d967b72f58752396e01bfdc3897dced34d",
      "mtime_observed": "2026-07-21T05:31:39.099Z"
    }
  },
  "historical_signed_rc_declaration": {
    "product_version": "0.1.0-rc.2",
    "release_status": "rc_candidate_verified",
    "rc_signed": true,
    "source_path": "out/releases/release-manifest-0.1.0-rc.2.json",
    "git": {
      "branch": "codex/two-week-release-critical",
      "head": "b4470f4c5de5992b30411a9a1c3b82ba1aabfdfd",
      "semantics": "historical_manifest_declaration_not_current_checkout_assertion"
    },
    "expected_rbz": {
      "path": "out/releases/alma-sketchup-mcp-0.1.0-rc.2.rbz",
      "size_bytes": 70724,
      "sha256": "sha256:4b20f4d26220d3e7b933b7a27f6eb6f74997fbad0bcb46ef5bc39b0a64e5ed0a"
    },
    "sidecar": {
      "path": "out/releases/alma-sketchup-mcp-0.1.0-rc.2.sha256",
      "declared_filename": "alma-sketchup-mcp-0.1.0-rc.2.rbz",
      "declared_sha256": "sha256:4b20f4d26220d3e7b933b7a27f6eb6f74997fbad0bcb46ef5bc39b0a64e5ed0a"
    }
  },
  "comparison": {
    "manifest_and_sidecar_sha256_match": true,
    "manifest_and_current_rbz_size_match": false,
    "manifest_and_current_rbz_sha256_match": false,
    "sidecar_and_current_rbz_sha256_match": false,
    "manifest_sidecar_consistent_current_rbz_inconsistent": true,
    "size_delta_bytes": 19708,
    "mtime_semantics": "observation_only_not_causal_attribution",
    "mtime_used_for_causal_attribution": false,
    "drift_cause": "undetermined"
  },
  "integrity_decision": {
    "current_artifact_status": "invalid_for_signed_rc",
    "signed_rc_identity_valid": false,
    "current_artifact_overwrite_allowed": false,
    "current_artifact_delete_allowed": false,
    "automatic_self_repair_allowed": false,
    "historical_manifest_or_sidecar_rewrite_allowed": false,
    "allowed_recovery_paths": [
      "recover_historical_copy_matching_manifest_and_sidecar",
      "rebuild_as_new_version_and_regenerate_manifest_sidecar_and_signature"
    ]
  },
  "release_acceptance": false,
  "boundary": "This portable public evidence is a read-only integrity snapshot of exactly three repository-relative 0.1.0-rc.2 release artifacts. It records that the historical manifest and sidecar agree with each other, while the currently present RBZ differs in both byte size and SHA-256. File modification times are observations only and do not identify who or what caused the drift. The manifest branch and head are historical declarations, not assertions about the current checkout. This verifier does not authorize overwriting, deleting, repairing, repackaging, signing, or publishing any artifact, and it does not establish release acceptance."
}
